cpc_group,cpc_title,best_year,highest_ema
C25D,PROCESSES FOR THE ELECTROLYTIC OR ELECTROPHORETIC PRODUCTION OF COATINGS; ELECTROFORMING; APPARATUS THEREFOR,2018,14.96448468097605
F24C,"DOMESTIC STOVES OR RANGES ; DETAILS OF DOMESTIC STOVES OR RANGES, OF GENERAL APPLICATION",2018,14.765916992784565
F04C,"ROTARY-PISTON, OR OSCILLATING-PISTON, POSITIVE-DISPLACEMENT MACHINES FOR LIQUIDS; ROTARY-PISTON, OR OSCILLATING-PISTON, POSITIVE-DISPLACEMENT PUMPS",2018,14.65859858053373
B64U,UNMANNED AERIAL VEHICLES [UAV]; EQUIPMENT THEREFOR,2021,14.602748044083203
A01D,HARVESTING; MOWING,2018,14.498965033486337
C10G,"CRACKING HYDROCARBON OILS; PRODUCTION OF LIQUID HYDROCARBON MIXTURES, e.g. BY DESTRUCTIVE HYDROGENATION, OLIGOMERISATION, POLYMERISATION; RECOVERY OF HYDROCARBON OILS FROM OIL-SHALE, OIL-SAND, OR GASES; REFINING MIXTURES MAINLY CONSISTING OF HYDROCARBONS; REFORMING OF NAPHTHA; MINERAL WAXES",2018,14.44643361191116
C07F,"ACYCLIC, CARBOCYCLIC OR HETEROCYCLIC COMPOUNDS CONTAINING ELEMENTS OTHER THAN CARBON, HYDROGEN, HALOGEN, OXYGEN, NITROGEN, SULFUR, SELENIUM OR TELLURIUM",2019,14.443964224080727
B23B,TURNING; BORING,2018,14.262674884766732
D06M,"TREATMENT, NOT PROVIDED FOR ELSEWHERE IN CLASS D06, OF FIBRES, THREADS, YARNS, FABRICS, FEATHERS OR FIBROUS GOODS MADE FROM SUCH MATERIALS",2018,14.071100032625035
B60Q,"ARRANGEMENT OF SIGNALLING OR LIGHTING DEVICES, THE MOUNTING OR SUPPORTING THEREOF OR CIRCUITS THEREFOR, FOR VEHICLES IN GENERAL",2019,13.982126521563597
F15B,"SYSTEMS ACTING BY MEANS OF FLUIDS IN GENERAL; FLUID-PRESSURE ACTUATORS, e.g. SERVOMOTORS; DETAILS OF FLUID-PRESSURE SYSTEMS, NOT OTHERWISE PROVIDED FOR",2018,13.903861894826484
E01D,"CONSTRUCTION OF BRIDGES, ELEVATED ROADWAYS OR VIADUCTS; ASSEMBLY OF BRIDGES",2018,13.85278817995238
H02B,"BOARDS, SUBSTATIONS OR SWITCHING ARRANGEMENTS FOR THE SUPPLY OR DISTRIBUTION OF ELECTRIC POWER",2022,13.747670651381851
E01C,"CONSTRUCTION OF, OR SURFACES FOR, ROADS, SPORTS GROUNDS, OR THE LIKE; MACHINES OR AUXILIARY TOOLS FOR CONSTRUCTION OR REPAIR",2018,13.745872115556123
F16M,"FRAMES, CASINGS OR BEDS OF ENGINES, MACHINES OR APPARATUS, NOT SPECIFIC TO ENGINES, MACHINES OR APPARATUS PROVIDED FOR ELSEWHERE; STANDS; SUPPORTS",2022,13.717129804717114
C03B,"MANUFACTURE, SHAPING, OR SUPPLEMENTARY PROCESSES",2018,13.696751375958847
H02H,EMERGENCY PROTECTIVE CIRCUIT ARRANGEMENTS,2022,13.57463355224682
A01H,NEW PLANTS OR NON-TRANSGENIC PROCESSES FOR OBTAINING THEM; PLANT REPRODUCTION BY TISSUE CULTURE TECHNIQUES,2019,13.358570031996809
B60H,"ARRANGEMENTS OF HEATING, COOLING, VENTILATING OR OTHER AIR-TREATING DEVICES SPECIALLY ADAPTED FOR PASSENGER OR GOODS SPACES OF VEHICLES",2022,13.303385535112701
F01D,"NON-POSITIVE DISPLACEMENT MACHINES OR ENGINES, e.g. STEAM TURBINES",2018,13.21849543575456
A41D,OUTERWEAR; PROTECTIVE GARMENTS; ACCESSORIES,2018,13.20380984297131
