cpc_group_lvl5,cpc_title_full,BEST_YEAR,BEST_EMA
B61F,"RAIL VEHICLE SUSPENSIONS, e.g. UNDERFRAMES, BOGIES OR ARRANGEMENTS OF WHEEL AXLES; RAIL VEHICLES FOR USE ON TRACKS OF DIFFERENT WIDTH; PREVENTING DERAILING OF RAIL VEHICLES; WHEEL GUARDS, OBSTRUCTION REMOVERS OR THE LIKE FOR RAIL VEHICLES",0,18.0
E01B,PERMANENT WAY; PERMANENT-WAY TOOLS; MACHINES FOR MAKING RAILWAYS OF ALL KINDS,0,18.0
F24H,"FLUID HEATERS, e.g. WATER OR AIR HEATERS, HAVING HEAT-GENERATING MEANS, e.g. HEAT PUMPS, IN GENERAL",0,18.0
F16M,"FRAMES, CASINGS OR BEDS OF ENGINES, MACHINES OR APPARATUS, NOT SPECIFIC TO ENGINES, MACHINES OR APPARATUS PROVIDED FOR ELSEWHERE; STANDS; SUPPORTS",2022,17.964541170814734
C25D,PROCESSES FOR THE ELECTROLYTIC OR ELECTROPHORETIC PRODUCTION OF COATINGS; ELECTROFORMING; APPARATUS THEREFOR,2018,17.550853130583317
B60H,"ARRANGEMENTS OF HEATING, COOLING, VENTILATING OR OTHER AIR-TREATING DEVICES SPECIALLY ADAPTED FOR PASSENGER OR GOODS SPACES OF VEHICLES",2018,17.546268411097966
A01H,NEW PLANTS OR NON-TRANSGENIC PROCESSES FOR OBTAINING THEM; PLANT REPRODUCTION BY TISSUE CULTURE TECHNIQUES,2019,17.09956422065118
C10B,"DESTRUCTIVE DISTILLATION OF CARBONACEOUS MATERIALS FOR PRODUCTION OF GAS, COKE, TAR, OR SIMILAR MATERIALS",0,17.0
F24B,DOMESTIC STOVES OR RANGES FOR SOLID FUELS; IMPLEMENTS FOR USE IN CONNECTION WITH STOVES OR RANGES,0,17.0
B41F,PRINTING MACHINES OR PRESSES,0,17.0
D04B,KNITTING,0,17.0
F26B,DRYING SOLID MATERIALS OR OBJECTS BY REMOVING LIQUID THEREFROM,0,17.0
A45D,"HAIRDRESSING OR SHAVING EQUIPMENT; EQUIPMENT FOR COSMETICS OR COSMETIC TREATMENTS, e.g. FOR MANICURING OR PEDICURING",2017,16.918042908724026
H02H,EMERGENCY PROTECTIVE CIRCUIT ARRANGEMENTS,2018,16.876116916363316
E04F,"FINISHING WORK ON BUILDINGS, e.g. STAIRS, FLOORS",2019,16.8703215080976
B60Q,"ARRANGEMENT OF SIGNALLING OR LIGHTING DEVICES, THE MOUNTING OR SUPPORTING THEREOF OR CIRCUITS THEREFOR, FOR VEHICLES IN GENERAL",2021,16.586296726979946
C10G,"CRACKING HYDROCARBON OILS; PRODUCTION OF LIQUID HYDROCARBON MIXTURES, e.g. BY DESTRUCTIVE HYDROGENATION, OLIGOMERISATION, POLYMERISATION; RECOVERY OF HYDROCARBON OILS FROM OIL-SHALE, OIL-SAND, OR GASES; REFINING MIXTURES MAINLY CONSISTING OF HYDROCARBONS; REFORMING OF NAPHTHA; MINERAL WAXES",2021,16.49166638135596
A41D,OUTERWEAR; PROTECTIVE GARMENTS; ACCESSORIES,2021,16.41658876475441
C22B,PRODUCTION AND REFINING OF METALS; PRETREATMENT OF RAW MATERIALS,2018,16.400708015131844
C01G,COMPOUNDS CONTAINING METALS NOT COVERED BY SUBCLASSES C01D OR C01F,2022,16.34010302151822
F28D,"HEAT-EXCHANGE APPARATUS, NOT PROVIDED FOR IN ANOTHER SUBCLASS, IN WHICH THE HEAT-EXCHANGE MEDIA DO NOT COME INTO DIRECT CONTACT",2021,16.131015473155177
C12M,"APPARATUS FOR ENZYMOLOGY OR MICROBIOLOGY; APPARATUS FOR CULTURING MICROORGANISMS FOR PRODUCING BIOMASS, FOR GROWING CELLS OR FOR OBTAINING FERMENTATION OR METABOLIC PRODUCTS, i.e. BIOREACTORS OR FERMENTERS",2021,16.059126764515042
