cpc_group_lvl5,cpc_title_full,BEST_YEAR,BEST_EMA
G06F,ELECTRIC DIGITAL DATA PROCESSING,2021,710.3909845103287
H04L,"TRANSMISSION OF DIGITAL INFORMATION, e.g. TELEGRAPHIC COMMUNICATION",2021,402.9153975662156
A61K,"PREPARATIONS FOR MEDICAL, DENTAL OR TOILETRY PURPOSES",2021,398.42924940262526
H01L,SEMICONDUCTOR DEVICES NOT COVERED BY CLASS H10,2021,368.15105311045386
H04W,WIRELESS COMMUNICATION NETWORKS,2021,303.84345071904363
G06Q,"INFORMATION AND COMMUNICATION TECHNOLOGY [ICT] SPECIALLY ADAPTED FOR ADMINISTRATIVE, COMMERCIAL, FINANCIAL, MANAGERIAL OR SUPERVISORY PURPOSES; SYSTEMS OR METHODS SPECIALLY ADAPTED FOR ADMINISTRATIVE, COMMERCIAL, FINANCIAL, MANAGERIAL OR SUPERVISORY PURPOSES, NOT OTHERWISE PROVIDED FOR",2022,276.6170323985271
G01N,INVESTIGATING OR ANALYSING MATERIALS BY DETERMINING THEIR CHEMICAL OR PHYSICAL PROPERTIES,2021,259.9356279030158
A61B,DIAGNOSIS; SURGERY; IDENTIFICATION,2021,250.29711295577488
H04N,"PICTORIAL COMMUNICATION, e.g. TELEVISION",2021,241.71507792226953
H01M,"PROCESSES OR MEANS, e.g. BATTERIES, FOR THE DIRECT CONVERSION OF CHEMICAL ENERGY INTO ELECTRICAL ENERGY",2022,183.116721086804
G06T,"IMAGE DATA PROCESSING OR GENERATION, IN GENERAL",2022,171.73369985606797
C07D,HETEROCYCLIC COMPOUNDS,2018,168.9801599835896
G02B,"OPTICAL ELEMENTS, SYSTEMS OR APPARATUS",2020,154.47302647646518
C12N,"MICROORGANISMS OR ENZYMES; COMPOSITIONS THEREOF; PROPAGATING, PRESERVING, OR MAINTAINING MICROORGANISMS; MUTATION OR GENETIC ENGINEERING; CULTURE MEDIA",2021,134.6605412760061
C07K,PEPTIDES,2021,129.09822943610982
B29C,"SHAPING OR JOINING OF PLASTICS; SHAPING OF MATERIAL IN A PLASTIC STATE, NOT OTHERWISE PROVIDED FOR; AFTER-TREATMENT OF THE SHAPED PRODUCTS, e.g. REPAIRING",2021,108.96506261300502
H04B,TRANSMISSION,2021,106.79038416176343
B01D,SEPARATION,2018,104.6806328909233
G01R,MEASURING ELECTRIC VARIABLES; MEASURING MAGNETIC VARIABLES,2018,101.73311970690713
A61M,"DEVICES FOR INTRODUCING MEDIA INTO, OR ONTO, THE BODY; DEVICES FOR TRANSDUCING BODY MEDIA OR FOR TAKING MEDIA FROM THE BODY; DEVICES FOR PRODUCING OR ENDING SLEEP OR STUPOR",2021,100.23680622860556
G06V,IMAGE OR VIDEO RECOGNITION OR UNDERSTANDING,2022,98.97744482437088
H02J,CIRCUIT ARRANGEMENTS OR SYSTEMS FOR SUPPLYING OR DISTRIBUTING ELECTRIC POWER; SYSTEMS FOR STORING ELECTRIC ENERGY,2022,90.24668432050686
C08L,COMPOSITIONS OF MACROMOLECULAR COMPOUNDS,2018,88.4960038927805
A61F,"FILTERS IMPLANTABLE INTO BLOOD VESSELS; PROSTHESES; DEVICES PROVIDING PATENCY TO, OR PREVENTING COLLAPSING OF, TUBULAR STRUCTURES OF THE BODY, e.g. STENTS; ORTHOPAEDIC, NURSING OR CONTRACEPTIVE DEVICES; FOMENTATION; TREATMENT OR PROTECTION OF EYES OR EARS; BANDAGES, DRESSINGS OR ABSORBENT PADS; FIRST-AID KITS",2019,87.41046363563042
B01J,"CHEMICAL OR PHYSICAL PROCESSES, e.g. CATALYSIS OR COLLOID CHEMISTRY; THEIR RELEVANT APPARATUS",2018,83.88958557782638
G11B,INFORMATION STORAGE BASED ON RELATIVE MOVEMENT BETWEEN RECORD CARRIER AND TRANSDUCER,2007,81.50157725275962
H05K,PRINTED CIRCUITS; CASINGS OR CONSTRUCTIONAL DETAILS OF ELECTRIC APPARATUS; MANUFACTURE OF ASSEMBLAGES OF ELECTRICAL COMPONENTS,2021,81.09188329916418
C07C,ACYCLIC OR CARBOCYCLIC COMPOUNDS,2018,80.26032632811709
G01S,RADIO DIRECTION-FINDING; RADIO NAVIGATION; DETERMINING DISTANCE OR VELOCITY BY USE OF RADIO WAVES; LOCATING OR PRESENCE-DETECTING BY USE OF THE REFLECTION OR RERADIATION OF RADIO WAVES; ANALOGOUS ARRANGEMENTS USING OTHER WAVES,2022,78.31572353938114
B32B,"LAYERED PRODUCTS, i.e. PRODUCTS BUILT-UP OF STRATA OF FLAT OR NON-FLAT, e.g. CELLULAR OR HONEYCOMB, FORM",2018,76.55733413935263
B65D,"CONTAINERS FOR STORAGE OR TRANSPORT OF ARTICLES OR MATERIALS, e.g. BAGS, BARRELS, BOTTLES, BOXES, CANS, CARTONS, CRATES, DRUMS, JARS, TANKS, HOPPERS, FORWARDING CONTAINERS; ACCESSORIES, CLOSURES, OR FITTINGS THEREFOR; PACKAGING ELEMENTS; PACKAGES",2018,76.07114481206656
E21B,"EARTH OR ROCK DRILLING; OBTAINING OIL, GAS, WATER, SOLUBLE OR MELTABLE MATERIALS OR A SLURRY OF MINERALS FROM WELLS",2021,75.9905409983397
C09D,"COATING COMPOSITIONS, e.g. PAINTS, VARNISHES OR LACQUERS; FILLING PASTES; CHEMICAL PAINT OR INK REMOVERS; INKS; CORRECTING FLUIDS; WOODSTAINS; PASTES OR SOLIDS FOR COLOURING OR PRINTING; USE OF MATERIALS THEREFOR",2018,73.24051358206265
H10K,ORGANIC ELECTRIC SOLID-STATE DEVICES,2021,72.88888159086652
G05B,CONTROL OR REGULATING SYSTEMS IN GENERAL; FUNCTIONAL ELEMENTS OF SUCH SYSTEMS; MONITORING OR TESTING ARRANGEMENTS FOR SUCH SYSTEMS OR ELEMENTS,2021,72.53588557910447
C02F,"TREATMENT OF WATER, WASTE WATER, SEWAGE, OR SLUDGE",2018,72.16260265564631
B23K,"SOLDERING OR UNSOLDERING; WELDING; CLADDING OR PLATING BY SOLDERING OR WELDING; CUTTING BY APPLYING HEAT LOCALLY, e.g. FLAME CUTTING; WORKING BY LASER BEAM",2018,70.89339027041872
G06N,COMPUTING ARRANGEMENTS BASED ON SPECIFIC COMPUTATIONAL MODELS,2022,70.04787898615805
G02F,OPTICAL DEVICES OR ARRANGEMENTS FOR THE CONTROL OF LIGHT BY MODIFICATION OF THE OPTICAL PROPERTIES OF THE MEDIA OF THE ELEMENTS INVOLVED THEREIN; NON-LINEAR OPTICS; FREQUENCY-CHANGING OF LIGHT; OPTICAL LOGIC ELEMENTS; OPTICAL ANALOGUE/DIGITAL CONVERTERS,2018,68.18415784636643
A23L,"FOODS, FOODSTUFFS, OR NON-ALCOHOLIC BEVERAGES, NOT COVERED BY SUBCLASSES A21D OR A23B-A23J; THEIR PREPARATION OR TREATMENT, e.g. COOKING, MODIFICATION OF NUTRITIVE QUALITIES, PHYSICAL TREATMENT; PRESERVATION OF FOODS OR FOODSTUFFS, IN GENERAL",2018,67.9652832027173
B65G,"TRANSPORT OR STORAGE DEVICES, e.g. CONVEYORS FOR LOADING OR TIPPING, SHOP CONVEYOR SYSTEMS OR PNEUMATIC TUBE CONVEYORS",2022,67.30948920666125
C04B,"LIME, MAGNESIA; SLAG; CEMENTS; COMPOSITIONS THEREOF, e.g. MORTARS, CONCRETE OR LIKE BUILDING MATERIALS; ARTIFICIAL STONE; CERAMICS; REFRACTORIES; TREATMENT OF NATURAL STONE",2018,67.20197293859404
H01R,ELECTRICALLY-CONDUCTIVE CONNECTIONS; STRUCTURAL ASSOCIATIONS OF A PLURALITY OF MUTUALLY-INSULATED ELECTRICAL CONNECTING ELEMENTS; COUPLING DEVICES; CURRENT COLLECTORS,2018,66.87130246911875
C23C,"COATING METALLIC MATERIAL; COATING MATERIAL WITH METALLIC MATERIAL; SURFACE TREATMENT OF METALLIC MATERIAL BY DIFFUSION INTO THE SURFACE, BY CHEMICAL CONVERSION OR SUBSTITUTION; COATING BY VACUUM EVAPORATION, BY SPUTTERING, BY ION IMPLANTATION OR BY CHEMICAL VAPOUR DEPOSITION, IN GENERAL",2018,65.9089929650323
B60R,"VEHICLES, VEHICLE FITTINGS, OR VEHICLE PARTS, NOT OTHERWISE PROVIDED FOR",2021,65.45461936656069
C08G,MACROMOLECULAR COMPOUNDS OBTAINED OTHERWISE THAN BY REACTIONS ONLY INVOLVING UNSATURATED CARBON-TO-CARBON BONDS,2018,64.71625895540856
G09G,ARRANGEMENTS OR CIRCUITS FOR CONTROL OF INDICATING DEVICES USING STATIC MEANS TO PRESENT VARIABLE INFORMATION,2020,64.04430743552756
H02K,DYNAMO-ELECTRIC MACHINES,2019,63.72303009322695
B60W,CONJOINT CONTROL OF VEHICLE SUB-UNITS OF DIFFERENT TYPE OR DIFFERENT FUNCTION; CONTROL SYSTEMS SPECIALLY ADAPTED FOR HYBRID VEHICLES; ROAD VEHICLE DRIVE CONTROL SYSTEMS FOR PURPOSES NOT RELATED TO THE CONTROL OF A PARTICULAR SUB-UNIT,2021,62.53753093597966
C12Q,"MEASURING OR TESTING PROCESSES INVOLVING ENZYMES, NUCLEIC ACIDS OR MICROORGANISMS; COMPOSITIONS OR TEST PAPERS THEREFOR; PROCESSES OF PREPARING SUCH COMPOSITIONS; CONDITION-RESPONSIVE CONTROL IN MICROBIOLOGICAL OR ENZYMOLOGICAL PROCESSES",2019,59.881138041967084
B62D,MOTOR VEHICLES; TRAILERS,2020,59.176803946726515
A61P,SPECIFIC THERAPEUTIC ACTIVITY OF CHEMICAL COMPOUNDS OR MEDICINAL PREPARATIONS,2022,56.33859416180681
C09K,"MATERIALS FOR MISCELLANEOUS APPLICATIONS, NOT PROVIDED FOR ELSEWHERE",2018,56.035706615896984
A01B,"SOIL WORKING IN AGRICULTURE OR FORESTRY; PARTS, DETAILS, OR ACCESSORIES OF AGRICULTURAL MACHINES OR IMPLEMENTS, IN GENERAL",0,55.0
A01D,HARVESTING; MOWING,0,54.0
F16H,GEARING,2018,53.83150729084996
F24F,AIR-CONDITIONING; AIR-HUMIDIFICATION; VENTILATION; USE OF AIR CURRENTS FOR SCREENING,2021,52.534176804197955
G06K,GRAPHICAL DATA READING; PRESENTATION OF DATA; RECORD CARRIERS; HANDLING RECORD CARRIERS,2020,52.46412711086989
H05B,"ELECTRIC HEATING; ELECTRIC LIGHT SOURCES NOT OTHERWISE PROVIDED FOR; CIRCUIT ARRANGEMENTS FOR ELECTRIC LIGHT SOURCES, IN GENERAL",2018,51.52137242245765
G11C,STATIC STORES,2021,51.274722158872194
H02M,"APPARATUS FOR CONVERSION BETWEEN AC AND AC, BETWEEN AC AND DC, OR BETWEEN DC AND DC, AND FOR USE WITH MAINS OR SIMILAR POWER SUPPLY SYSTEMS; CONVERSION OF DC OR AC INPUT POWER INTO SURGE OUTPUT POWER; CONTROL OR REGULATION THEREOF",2021,50.94669519332302
B25J,MANIPULATORS; CHAMBERS PROVIDED WITH MANIPULATION DEVICES,2021,50.51319658116529
G16H,"HEALTHCARE INFORMATICS, i.e. INFORMATION AND COMMUNICATION TECHNOLOGY [ICT] SPECIALLY ADAPTED FOR THE HANDLING OR PROCESSING OF MEDICAL OR HEALTHCARE DATA",2022,49.33029705955316
A01K,"ANIMAL HUSBANDRY; AVICULTURE; APICULTURE; PISCICULTURE; FISHING; REARING OR BREEDING ANIMALS, NOT OTHERWISE PROVIDED FOR; NEW BREEDS OF ANIMALS",2018,49.29933151000453
A01G,"HORTICULTURE; CULTIVATION OF VEGETABLES, FLOWERS, RICE, FRUIT, VINES, HOPS OR SEAWEED; FORESTRY; WATERING",2021,49.22772441627019
G05D,SYSTEMS FOR CONTROLLING OR REGULATING NON-ELECTRIC VARIABLES,2022,48.90653129966466
C22C,ALLOYS,2022,48.6945680296361
A01N,"PRESERVATION OF BODIES OF HUMANS OR ANIMALS OR PLANTS OR PARTS THEREOF; BIOCIDES, e.g. AS DISINFECTANTS, AS PESTICIDES OR AS HERBICIDES; PEST REPELLANTS OR ATTRACTANTS; PLANT GROWTH REGULATORS",2018,48.56706140873856
H04M,TELEPHONIC COMMUNICATION,2018,48.43554102404931
C08J,"WORKING-UP; GENERAL PROCESSES OF COMPOUNDING; AFTER-TREATMENT NOT COVERED BY SUBCLASSES C08B, C08C, C08F, C08G or C08H",2019,46.480946158749454
B60L,PROPULSION OF ELECTRICALLY-PROPELLED VEHICLES; SUPPLYING ELECTRIC POWER FOR AUXILIARY EQUIPMENT OF ELECTRICALLY-PROPELLED VEHICLES; ELECTRODYNAMIC BRAKE SYSTEMS FOR VEHICLES IN GENERAL; MAGNETIC SUSPENSION OR LEVITATION FOR VEHICLES; MONITORING OPERATING VARIABLES OF ELECTRICALLY-PROPELLED VEHICLES; ELECTRIC SAFETY DEVICES FOR ELECTRICALLY-PROPELLED VEHICLES,2022,46.45130418716069
C08F,MACROMOLECULAR COMPOUNDS OBTAINED BY REACTIONS ONLY INVOLVING CARBON-TO-CARBON UNSATURATED BONDS,2019,46.42263519413267
G01C,"MEASURING DISTANCES, LEVELS OR BEARINGS; SURVEYING; NAVIGATION; GYROSCOPIC INSTRUMENTS; PHOTOGRAMMETRY OR VIDEOGRAMMETRY",2021,46.18498583611225
B41J,"TYPEWRITERS; SELECTIVE PRINTING MECHANISMS, i.e. MECHANISMS PRINTING OTHERWISE THAN FROM A FORME; CORRECTION OF TYPOGRAPHICAL ERRORS",2019,46.072307881536496
B60K,"ARRANGEMENT OR MOUNTING OF PROPULSION UNITS OR OF TRANSMISSIONS IN VEHICLES; ARRANGEMENT OR MOUNTING OF PLURAL DIVERSE PRIME-MOVERS IN VEHICLES; AUXILIARY DRIVES FOR VEHICLES; INSTRUMENTATION OR DASHBOARDS FOR VEHICLES; ARRANGEMENTS IN CONNECTION WITH COOLING, AIR INTAKE, GAS EXHAUST OR FUEL SUPPLY OF PROPULSION UNITS IN VEHICLES",2021,44.89110066898171
H04R,"LOUDSPEAKERS, MICROPHONES, GRAMOPHONE PICK-UPS OR LIKE ACOUSTIC ELECTROMECHANICAL TRANSDUCERS; DEAF-AID SETS; PUBLIC ADDRESS SYSTEMS",2021,44.450007232251856
A61L,"METHODS OR APPARATUS FOR STERILISING MATERIALS OR OBJECTS IN GENERAL; DISINFECTION, STERILISATION OR DEODORISATION OF AIR; CHEMICAL ASPECTS OF BANDAGES, DRESSINGS, ABSORBENT PADS OR SURGICAL ARTICLES; MATERIALS FOR BANDAGES, DRESSINGS, ABSORBENT PADS OR SURGICAL ARTICLES",2021,44.412820483520456
G03F,"PHOTOMECHANICAL PRODUCTION OF TEXTURED OR PATTERNED SURFACES, e.g. FOR PRINTING, FOR PROCESSING OF SEMICONDUCTOR DEVICES; MATERIALS THEREFOR; ORIGINALS THEREFOR; APPARATUS SPECIALLY ADAPTED THEREFOR",2018,44.05924632285485
G01B,"MEASURING LENGTH, THICKNESS OR SIMILAR LINEAR DIMENSIONS; MEASURING ANGLES; MEASURING AREAS; MEASURING IRREGULARITIES OF SURFACES OR CONTOURS",2018,43.75130397019767
A47J,KITCHEN EQUIPMENT; COFFEE MILLS; SPICE MILLS; APPARATUS FOR MAKING BEVERAGES,2018,43.694585678529144
F16K,VALVES; TAPS; COCKS; ACTUATING-FLOATS; DEVICES FOR VENTING OR AERATING,2018,43.61077831123212
G01M,"TESTING STATIC OR DYNAMIC BALANCE OF MACHINES OR STRUCTURES; TESTING OF STRUCTURES OR APPARATUS, NOT OTHERWISE PROVIDED FOR",2021,43.49903268740339
A47C,CHAIRS; SOFAS; BEDS,0,43.0
G08G,TRAFFIC CONTROL SYSTEMS,2022,42.51833814949585
H01J,ELECTRIC DISCHARGE TUBES OR DISCHARGE LAMPS,2021,42.155221802476824
C01B,NON-METALLIC ELEMENTS; COMPOUNDS THEREOF; METALLOIDS OR COMPOUNDS THEREOF NOT COVERED BY SUBCLASS C01C,2021,42.045709927358054
F16L,"PIPES; JOINTS OR FITTINGS FOR PIPES; SUPPORTS FOR PIPES, CABLES OR PROTECTIVE TUBING; MEANS FOR THERMAL INSULATION IN GENERAL",2018,42.01115161157051
H01H,ELECTRIC SWITCHES; RELAYS; SELECTORS; EMERGENCY PROTECTIVE DEVICES,0,41.0
H01Q,"ANTENNAS, i.e. RADIO AERIALS",2021,40.31759219598946
G10L,SPEECH ANALYSIS TECHNIQUES OR SPEECH SYNTHESIS; SPEECH RECOGNITION; SPEECH OR VOICE PROCESSING TECHNIQUES; SPEECH OR AUDIO CODING OR DECODING,2022,40.18506782384128
A63B,"APPARATUS FOR PHYSICAL TRAINING, GYMNASTICS, SWIMMING, CLIMBING, OR FENCING; BALL GAMES; TRAINING EQUIPMENT",2021,39.76861229295528
G03G,ELECTROGRAPHY; ELECTROPHOTOGRAPHY; MAGNETOGRAPHY,2012,38.734478327823126
A61N,ELECTROTHERAPY; MAGNETOTHERAPY; RADIATION THERAPY; ULTRASOUND THERAPY,2021,38.27739299413936
H01F,MAGNETS; INDUCTANCES; TRANSFORMERS; SELECTION OF MATERIALS FOR THEIR MAGNETIC PROPERTIES,2021,38.122387672834044
E05B,LOCKS; ACCESSORIES THEREFOR; HANDCUFFS,0,35.0
F16B,"DEVICES FOR FASTENING OR SECURING CONSTRUCTIONAL ELEMENTS OR MACHINE PARTS TOGETHER, e.g. NAILS, BOLTS, CIRCLIPS, CLAMPS, CLIPS OR WEDGES; JOINTS OR JOINTING",0,35.0
B21D,"WORKING OR PROCESSING OF SHEET METAL OR METAL TUBES, RODS OR PROFILES WITHOUT ESSENTIALLY REMOVING MATERIAL; PUNCHING METAL",2018,34.3879271973977
F04D,NON-POSITIVE-DISPLACEMENT PUMPS,2018,34.18594632030589
B61G,COUPLINGS; DRAUGHT AND BUFFING APPLIANCES,0,34.0
B65B,"MACHINES, APPARATUS OR DEVICES FOR, OR METHODS OF, PACKAGING ARTICLES OR MATERIALS; UNPACKING",2018,33.412969209797886
B24B,"MACHINES, DEVICES, OR PROCESSES FOR GRINDING OR POLISHING; DRESSING OR CONDITIONING OF ABRADING SURFACES; FEEDING OF GRINDING, POLISHING, OR LAPPING AGENTS",2022,33.04973500359927
G08B,SIGNALLING OR CALLING SYSTEMS; ORDER TELEGRAPHS; ALARM SYSTEMS,2021,32.73728028390299
C08K,Use of inorganic or non-macromolecular organic substances as compounding ingredients,2017,32.04346587293372
B65H,"HANDLING THIN OR FILAMENTARY MATERIAL, e.g. SHEETS, WEBS, CABLES",2020,32.01138628262946
A47B,TABLES; DESKS; OFFICE FURNITURE; CABINETS; DRAWERS; GENERAL DETAILS OF FURNITURE,0,32.0
G03B,APPARATUS OR ARRANGEMENTS FOR TAKING PHOTOGRAPHS OR FOR PROJECTING OR VIEWING THEM; APPARATUS OR ARRANGEMENTS EMPLOYING ANALOGOUS TECHNIQUES USING WAVES OTHER THAN OPTICAL WAVES; ACCESSORIES THEREFOR,0,32.0
C09J,ADHESIVES; NON-MECHANICAL ASPECTS OF ADHESIVE PROCESSES IN GENERAL; ADHESIVE PROCESSES NOT PROVIDED FOR ELSEWHERE; USE OF MATERIALS AS ADHESIVES,2019,31.47290270663281
F16D,COUPLINGS FOR TRANSMITTING ROTATION; CLUTCHES; BRAKES,2018,31.281481961703193
A47G,HOUSEHOLD OR TABLE EQUIPMENT,0,31.0
D06F,"LAUNDERING, DRYING, IRONING, PRESSING OR FOLDING TEXTILE ARTICLES",2018,30.883503086003266
F21S,NON-PORTABLE LIGHTING DEVICES; SYSTEMS THEREOF; VEHICLE LIGHTING DEVICES SPECIALLY ADAPTED FOR VEHICLE EXTERIORS,2018,30.879121668319954
A47L,DOMESTIC WASHING OR CLEANING; SUCTION CLEANERS IN GENERAL,2021,30.76069421345505
E04B,"GENERAL BUILDING CONSTRUCTIONS; WALLS, e.g. PARTITIONS; ROOFS; FLOORS; CEILINGS; INSULATION OR OTHER PROTECTION OF BUILDINGS",2022,30.73082856782613
E02D,FOUNDATIONS; EXCAVATIONS; EMBANKMENTS; UNDERGROUND OR UNDERWATER STRUCTURES,2022,30.522985978030114
F02D,CONTROLLING COMBUSTION ENGINES,2018,30.217974740520027
A44B,"BUTTONS, PINS, BUCKLES, SLIDE FASTENERS, OR THE LIKE",0,30.0
B25B,"TOOLS OR BENCH DEVICES NOT OTHERWISE PROVIDED FOR, FOR FASTENING, CONNECTING, DISENGAGING OR HOLDING",0,30.0
B23Q,"DETAILS, COMPONENTS, OR ACCESSORIES FOR MACHINE TOOLS, e.g. ARRANGEMENTS FOR COPYING OR CONTROLLING; MACHINE TOOLS IN GENERAL CHARACTERISED BY THE CONSTRUCTION OF PARTICULAR DETAILS OR COMPONENTS; COMBINATIONS OR ASSOCIATIONS OF METAL-WORKING MACHINES, NOT DIRECTED TO A PARTICULAR RESULT",2018,29.8049374948962
B23P,METAL-WORKING NOT OTHERWISE PROVIDED FOR; COMBINED OPERATIONS; UNIVERSAL MACHINE TOOLS,2018,29.637930795586897
H03K,PULSE TECHNIQUE,2020,29.411660005398176
B23D,"PLANING; SLOTTING; SHEARING; BROACHING; SAWING; FILING; SCRAPING; LIKE OPERATIONS FOR WORKING METAL BY REMOVING MATERIAL, NOT OTHERWISE PROVIDED FOR",0,29.0
B08B,CLEANING IN GENERAL; PREVENTION OF FOULING IN GENERAL,2022,28.988454845579202
H01B,"CABLES; CONDUCTORS; INSULATORS; SELECTION OF MATERIALS FOR THEIR CONDUCTIVE, INSULATING OR DIELECTRIC PROPERTIES",2018,28.896636684054172
F01D,"NON-POSITIVE DISPLACEMENT MACHINES OR ENGINES, e.g. STEAM TURBINES",2018,28.417188890775964
F25B,"REFRIGERATION MACHINES, PLANTS OR SYSTEMS; COMBINED HEATING AND REFRIGERATION SYSTEMS; HEAT PUMP SYSTEMS",2019,28.34739035741354
F21V,"FUNCTIONAL FEATURES OR DETAILS OF LIGHTING DEVICES OR SYSTEMS THEREOF; STRUCTURAL COMBINATIONS OF LIGHTING DEVICES WITH OTHER ARTICLES, NOT OTHERWISE PROVIDED FOR",2017,28.1503424316641
B02C,"CRUSHING, PULVERISING, OR DISINTEGRATING IN GENERAL; MILLING GRAIN",0,28.0
F23D,BURNERS,0,28.0
C07F,"ACYCLIC, CARBOCYCLIC OR HETEROCYCLIC COMPOUNDS CONTAINING ELEMENTS OTHER THAN CARBON, HYDROGEN, HALOGEN, OXYGEN, NITROGEN, SULFUR, SELENIUM OR TELLURIUM",2018,27.531892369579193
B64C,AEROPLANES; HELICOPTERS,2019,27.376120128608314
H10B,ELECTRONIC MEMORY DEVICES,2021,27.223841717989913
B60N,SEATS SPECIALLY ADAPTED FOR VEHICLES; VEHICLE PASSENGER ACCOMMODATION NOT OTHERWISE PROVIDED FOR,2019,27.095237340574755
G09B,"EDUCATIONAL OR DEMONSTRATION APPLIANCES; APPLIANCES FOR TEACHING, OR COMMUNICATING WITH, THE BLIND, DEAF OR MUTE; MODELS; PLANETARIA; GLOBES; MAPS; DIAGRAMS",2019,27.08187176785183
B61L,GUIDING RAILWAY TRAFFIC; ENSURING THE SAFETY OF RAILWAY TRAFFIC,0,27.0
G09F,DISPLAYING; ADVERTISING; SIGNS; LABELS OR NAME-PLATES; SEALS,2022,26.970384602567343
F04B,POSITIVE-DISPLACEMENT MACHINES FOR LIQUIDS; PUMPS,2018,26.337414627880676
A24F,SMOKERS' REQUISITES; MATCH BOXES; SIMULATED SMOKING DEVICES,2022,26.31190159722072
H02P,"CONTROL OR REGULATION OF ELECTRIC MOTORS, ELECTRIC GENERATORS OR DYNAMO-ELECTRIC CONVERTERS; CONTROLLING TRANSFORMERS, REACTORS OR CHOKE COILS",2021,26.160279410412766
B05B,SPRAYING APPARATUS; ATOMISING APPARATUS; NOZZLES,2018,26.106295537685547
A63F,"CARD, BOARD, OR ROULETTE GAMES; INDOOR GAMES USING SMALL MOVING PLAYING BODIES; VIDEO GAMES; GAMES NOT OTHERWISE PROVIDED FOR",2021,26.051476835175905
E04H,"BUILDINGS OR LIKE STRUCTURES FOR PARTICULAR PURPOSES; SWIMMING OR SPLASH BATHS OR POOLS; MASTS; FENCING; TENTS OR CANOPIES, IN GENERAL",0,26.0
H02G,"INSTALLATION OF ELECTRIC CABLES OR LINES, OR OF COMBINED OPTICAL AND ELECTRIC CABLES OR LINES",2022,25.380964212894625
G01V,GEOPHYSICS; GRAVITATIONAL MEASUREMENTS; DETECTING MASSES OR OBJECTS; TAGS,2018,25.1396014349974
B64D,EQUIPMENT FOR FITTING IN OR TO AIRCRAFT; FLIGHT SUITS; PARACHUTES; ARRANGEMENT OR MOUNTING OF POWER PLANTS OR PROPULSION TRANSMISSIONS IN AIRCRAFT,2020,25.09068178138319
B01L,CHEMICAL OR PHYSICAL LABORATORY APPARATUS FOR GENERAL USE,2020,24.93891718251037
E06B,"FIXED OR MOVABLE CLOSURES FOR OPENINGS IN BUILDINGS, VEHICLES, FENCES OR LIKE ENCLOSURES IN GENERAL, e.g. DOORS, WINDOWS, BLINDS, GATES",2018,24.87968099651878
A61H,"PHYSICAL THERAPY APPARATUS, e.g. DEVICES FOR LOCATING OR STIMULATING REFLEX POINTS IN THE BODY; ARTIFICIAL RESPIRATION; MASSAGE; BATHING DEVICES FOR SPECIAL THERAPEUTIC OR HYGIENIC PURPOSES OR SPECIFIC PARTS OF THE BODY",2022,24.826655151504827
F02M,SUPPLYING COMBUSTION ENGINES IN GENERAL WITH COMBUSTIBLE MIXTURES OR CONSTITUENTS THEREOF,2019,24.82297814193717
H01G,"CAPACITORS; CAPACITORS, RECTIFIERS, DETECTORS, SWITCHING DEVICES, LIGHT-SENSITIVE OR TEMPERATURE-SENSITIVE DEVICES OF THE ELECTROLYTIC TYPE",2018,24.184033874645422
B66C,"CRANES; LOAD-ENGAGING ELEMENTS OR DEVICES FOR CRANES, CAPSTANS, WINCHES, OR TACKLES",0,24.0
C09B,"ORGANIC DYES OR CLOSELY-RELATED COMPOUNDS FOR PRODUCING DYES, e.g. PIGMENTS; MORDANTS; LAKES",0,24.0
F16C,SHAFTS; FLEXIBLE SHAFTS; ELEMENTS OR CRANKSHAFT MECHANISMS; ROTARY BODIES OTHER THAN GEARING ELEMENTS; BEARINGS,2019,23.969784391998267
C03C,"CHEMICAL COMPOSITION OF GLASSES, GLAZES OR VITREOUS ENAMELS; SURFACE TREATMENT OF GLASS; SURFACE TREATMENT OF FIBRES OR FILAMENTS MADE FROM GLASS, MINERALS OR SLAGS; JOINING GLASS TO GLASS OR OTHER MATERIALS",2018,23.80610886303739
F01N,GAS-FLOW SILENCERS OR EXHAUST APPARATUS FOR MACHINES OR ENGINES IN GENERAL; GAS-FLOW SILENCERS OR EXHAUST APPARATUS FOR INTERNAL COMBUSTION ENGINES,2018,23.254648298373674
B63B,SHIPS OR OTHER WATERBORNE VESSELS; EQUIPMENT FOR SHIPPING ,2018,23.23439356710287
B82Y,SPECIFIC USES OR APPLICATIONS OF NANOSTRUCTURES; MEASUREMENT OR ANALYSIS OF NANOSTRUCTURES; MANUFACTURE OR TREATMENT OF NANOSTRUCTURES,2004,23.123940776169146
A01C,PLANTING; SOWING; FERTILISING,0,23.0
B07B,"SEPARATING SOLIDS FROM SOLIDS BY SIEVING, SCREENING, SIFTING OR BY USING GAS CURRENTS; SEPARATING BY OTHER DRY METHODS APPLICABLE TO BULK MATERIAL, e.g. LOOSE ARTICLES FIT TO BE HANDLED LIKE BULK MATERIAL",0,23.0
D05B,SEWING,0,23.0
F22B,METHODS OF STEAM GENERATION; STEAM BOILERS,0,23.0
F25D,REFRIGERATORS; COLD ROOMS; ICE-BOXES; COOLING OR FREEZING APPARATUS NOT OTHERWISE PROVIDED FOR,2019,22.977212753806686
B66B,ELEVATORS; ESCALATORS OR MOVING WALKWAYS,2018,22.74620725170476
E04G,"SCAFFOLDING; FORMS; SHUTTERING; BUILDING IMPLEMENTS OR AIDS, OR THEIR USE; HANDLING BUILDING MATERIALS ON THE SITE; REPAIRING, BREAKING-UP OR OTHER WORK ON EXISTING BUILDINGS",2022,22.680676562998496
B60T,"VEHICLE BRAKE CONTROL SYSTEMS OR PARTS THEREOF; BRAKE CONTROL SYSTEMS OR PARTS THEREOF, IN GENERAL; ARRANGEMENT OF BRAKING ELEMENTS ON VEHICLES IN GENERAL; PORTABLE DEVICES FOR PREVENTING UNWANTED MOVEMENT OF VEHICLES; VEHICLE MODIFICATIONS TO FACILITATE COOLING OF BRAKES",2020,22.64866513700526
G07F,COIN-FREED OR LIKE APPARATUS,2006,22.574062734874374
B60C,VEHICLE TYRES; TYRE INFLATION; TYRE CHANGING; CONNECTING VALVES TO INFLATABLE ELASTIC BODIES IN GENERAL; DEVICES OR ARRANGEMENTS RELATED TO TYRES,2017,22.514060609635848
C12P,FERMENTATION OR ENZYME-USING PROCESSES TO SYNTHESISE A DESIRED CHEMICAL COMPOUND OR COMPOSITION OR TO SEPARATE OPTICAL ISOMERS FROM A RACEMIC MIXTURE,2018,22.383668947636963
G07C,"TIME OR ATTENDANCE REGISTERS; REGISTERING OR INDICATING THE WORKING OF MACHINES; GENERATING RANDOM NUMBERS; VOTING OR LOTTERY APPARATUS; ARRANGEMENTS, SYSTEMS OR APPARATUS FOR CHECKING NOT PROVIDED FOR ELSEWHERE",2020,22.27666429297505
B01F,"MIXING, e.g. DISSOLVING, EMULSIFYING OR DISPERSING",2020,22.13855291015653
B22F,WORKING METALLIC POWDER; MANUFACTURE OF ARTICLES FROM METALLIC POWDER; MAKING METALLIC POWDER; APPARATUS OR DEVICES SPECIALLY ADAPTED FOR METALLIC POWDER,2022,22.034100365878615
F41A,"FUNCTIONAL FEATURES OR DETAILS COMMON TO BOTH SMALLARMS AND ORDNANCE, e.g. CANNONS; MOUNTINGS FOR SMALLARMS OR ORDNANCE",0,22.0
G01J,"MEASUREMENT OF INTENSITY, VELOCITY, SPECTRAL CONTENT, POLARISATION, PHASE OR PULSE CHARACTERISTICS OF INFRARED, VISIBLE OR ULTRAVIOLET LIGHT; COLORIMETRY; RADIATION PYROMETRY",2021,21.791299270758387
G01D,MEASURING NOT SPECIALLY ADAPTED FOR A SPECIFIC VARIABLE; ARRANGEMENTS FOR MEASURING TWO OR MORE VARIABLES NOT COVERED IN A SINGLE OTHER SUBCLASS; TARIFF METERING APPARATUS; MEASURING OR TESTING NOT OTHERWISE PROVIDED FOR,2021,21.58197637353057
A61C,DENTISTRY; APPARATUS OR METHODS FOR ORAL OR DENTAL HYGIENE,2019,21.504541748581566
C21D,"MODIFYING THE PHYSICAL STRUCTURE OF FERROUS METALS; GENERAL DEVICES FOR HEAT TREATMENT OF FERROUS OR NON-FERROUS METALS OR ALLOYS; MAKING METAL MALLEABLE, e.g. BY DECARBURISATION OR TEMPERING",2019,20.846603768645053
H01S,DEVICES USING THE PROCESS OF LIGHT AMPLIFICATION BY STIMULATED EMISSION OF RADIATION [LASER] TO AMPLIFY OR GENERATE LIGHT; DEVICES USING STIMULATED EMISSION OF ELECTROMAGNETIC RADIATION IN WAVE RANGES OTHER THAN OPTICAL,2021,20.58092486601091
H03M,CODING; DECODING; CODE CONVERSION IN GENERAL,2018,20.55102853308739
E02F,DREDGING; SOIL-SHIFTING,2021,20.26375638657995
C11D,DETERGENT COMPOSITIONS; USE OF SINGLE SUBSTANCES AS DETERGENTS; SOAP OR SOAP-MAKING; RESIN SOAPS; RECOVERY OF GLYCEROL,2018,20.014723077617084
D01H,SPINNING OR TWISTING,0,20.0
F16N,LUBRICATING,0,20.0
F16F,SPRINGS; SHOCK-ABSORBERS; MEANS FOR DAMPING VIBRATION,2020,19.861296221957268
H10N,ELECTRIC SOLID-STATE DEVICES NOT OTHERWISE PROVIDED FOR,2021,19.75297855945692
G01F,"MEASURING VOLUME, VOLUME FLOW, MASS FLOW OR LIQUID LEVEL; METERING BY VOLUME",2018,19.166218224279884
B26D,"CUTTING; DETAILS COMMON TO MACHINES FOR PERFORATING, PUNCHING, CUTTING-OUT, STAMPING-OUT OR SEVERING",0,19.0
B60B,VEHICLE WHEELS; CASTORS; AXLES FOR WHEELS OR CASTORS; INCREASING WHEEL ADHESION,0,19.0
B62C,VEHICLES DRAWN BY ANIMALS,0,19.0
C03B,"MANUFACTURE, SHAPING, OR SUPPLEMENTARY PROCESSES",0,19.0
D03D,WOVEN FABRICS; METHODS OF WEAVING; LOOMS,0,19.0
F01L,CYCLICALLY OPERATING VALVES FOR MACHINES OR ENGINES,0,19.0
A43D,"MACHINES, TOOLS, EQUIPMENT OR METHODS FOR MANUFACTURING OR REPAIRING FOOTWEAR",0,19.0
F03D,WIND MOTORS,2021,18.844237147048727
A61G,"TRANSPORT, PERSONAL CONVEYANCES, OR ACCOMMODATION SPECIALLY ADAPTED FOR PATIENTS OR DISABLED PERSONS; OPERATING TABLES OR CHAIRS; CHAIRS FOR DENTISTRY; FUNERAL DEVICES",2022,18.814076860984702
H02S,"GENERATION OF ELECTRIC POWER BY CONVERSION OF INFRARED RADIATION, VISIBLE LIGHT OR ULTRAVIOLET LIGHT, e.g. USING PHOTOVOLTAIC [PV] MODULES",2021,18.752525127702164
G01L,"MEASURING FORCE, STRESS, TORQUE, WORK, MECHANICAL POWER, MECHANICAL EFFICIENCY, OR FLUID PRESSURE",2022,18.550141720863227
B23B,TURNING; BORING,2018,18.5073471640318
B22D,CASTING OF METALS; CASTING OF OTHER SUBSTANCES BY THE SAME PROCESSES OR DEVICES,2018,18.249589265898656
A23K,FODDER,2018,18.00516477598873
A63H,"TOYS, e.g. TOPS, DOLLS, HOOPS OR BUILDING BLOCKS",0,18.0
