PATENT_ID,title,abstract,PUBLICATION_DATE,BACKWARD_CITATIONS,FORWARD_CITATIONS_5YRS
8623816,Compositions and methods for treating malaria with cupredoxin and cytochrome,"The present invention relates to cupredoxin and cytochrome and their use, separately or together, to inhibit the spread of parasitemia in mammalian red blood cells and other tissues infected by the malaria parasite, and in particular the parasitemia of human red blood cells by P. falciparum. The invention provides isolated peptides that are variants, derivatives or structural equivalents of cupredoxins or cytochrome c, and compositions comprising cupredoxins and/or cytochrome c, or variants, derivatives or structural equivalents thereof, that are useful for treating or preventing malaria infection in mammals. Further, the invention provides methods to treat mammalian patients to prevent or inhibit the growth of malarial infection in mammals. The invention also provides methods to prevent the growth of malaria infection in insect vectors.",2014-01-07,1,0
8623834,Compositions including triciribine and trastuzumab and methods of use thereof,"This application relates to combination therapies including triciribine and related compounds and trastuzumab or a salt thereof and compositions with reduced toxicity for the treatment and prevention of tumors, cancer, and other disorders associated with abnormal cell proliferation.",2014-01-07,22,0
8623846,Diazeniumdiolate cyclohexyl derivatives,"A compound having the structure (I) or a pharmaceutically acceptable salt thereof, wherein R3 is hydrogen, deuterium, —OH, —OC1-6alkyl, or halogen; R8 is hydrogen, deuterium, or C1-6alkyl; R11 and R12 are independently hydrogen, —C1-6alkyl, —OH, —OC1-6alkyl, or halogen; R13 and R14 are independently —C1-6alkyl, —(CH2)1-2OH, or —OC1-6alkyl, or, together with the nitrogen atom to which they are attached, form a 4- to 7-membered heterocyclic ring containing one nitrogen atom and 0 or 1 oxygen atoms, wherein said ring is unsubstituted or mono-, di- or tri-substituted with halogen or —C1-6alkyl; R15 is —C(O)OH, —C(O)OCH2CH2N+CH3)3 wherein n is 0, 1 or 2, —C(O)NHCH(R17)OR16, or —C(O)NHCH(R17)C(O)NHCH(R18)C(O)OR16; R16 is hydrogen, C1-6alkyl, or (CH2)1-2N+R19R20R21; R1, R2, R4, R5, R6, R7, R9, R10, R17, R18, R19, R20, and R21 are independently hydrogen or —C1-6alkyl; and stereoisomers thereof, and pharmaceutically acceptable salts thereof, and pharmaceutically acceptable salts of stereoisomers thereof.",2014-01-07,3,0
8623851,Formoterol/steroid bronchodilating compositions and methods of use thereof,"Bronchodilating compositions and methods are provided. The compositions are intended for administration as a nebulized aerosol. In certain embodiments, the compositions contain formoterol, or a derivative thereof, and a steroidal anti-inflammatory agent. Methods for treatment, prevention, or amelioration of one or more symptoms of bronchoconstrictive disorders using the compositions provided herein are also provided.",2014-01-07,58,0
8623854,Nuclear export inhibitors of topoisomerase II alpha,"A method of treating cancer in a subject comprising the step of administering to the subject in need thereof an effective amount of a combination of a compound that binds a nuclear export signal (NES inhibitor) on topoisomerase IIα and a topoisomerase inhibitor. Twenty small molecule inhibitors (SMI) that bind to the two nuclear export sequences (NES) topo IIα have been identified from the NCI database using computer-generated molecular modeling. These SMI will improve the effectiveness of topo II directed therapeutics, particularly in the treatment of diseases such as multiple myeloma (MM). In vitro apoptosis assays indicate that these drugs may be effective as single agents or in combination with currently used cancer drugs that target topo II.",2014-01-07,0,0
